id;name;ownerId;content
1;Unit 1: My school;2;Learn about my school
2;Unit 2: My home ;2;Learn about My home
3;Unit 3: My friend;2;Learn about My friend
4;Unit 4: My neighborhood;2;Learn about My neighborhood
5;Unit 5: Natural wonders of the world;2;Learn about Natural wonders of the world
6;Unit 6: Our Tet holiday;2;Learn about Our Tet holiday
7;Unit 7: Television;2;Learn about Television
8;Unit 8: Sports and games;2;Learn about Sports and games
9;Unit 9: Cities of the world;2;Learn about Cities of the world
10;Unit 10: Our houses in the future;2;Learn about Our houses in the future
11;Unit 11: Our greener world;2;Learn about Our greener world
12;Unit 12: Robots;2;Learn about Robots